[
  {
    "headers": {
      "user-agent": "Mozilla/5.0 (Linux; Android 4.4.2; es-us; Avvio L500 Build/KVT49L) AppleWebKit/537.36 (KHTML, like Gecko) Chrome/34.0.1847.114 Mobile Safari/537.36"
    },
    "device": {
      "deviceName": "L500",
      "marketingName": "L500",
      "manufacturer": "Avvio",
      "brand": "Avvio",
      "pointingMethod": "touchscreen",
      "resolutionWidth": 480,
      "resolutionHeight": 854,
      "dualOrientation": true,
      "type": "smartphone"
    },
    "browser": {
      "name": "Chrome",
      "modus": null,
      "version": "34.0.1847.114",
      "manufacturer": "Google",
      "bits": 32,
      "type": "browser"
    },
    "os": {
      "name": "Android",
      "marketingName": "Android",
      "version": "4.4.2",
      "manufacturer": "Google",
      "bits": 32
    },
    "engine": {
      "name": "Blink",
      "version": "537.36.0",
      "manufacturer": "Google"
    }
  },
  {
    "headers": {
      "user-agent": "Mozilla/5.0 (Linux; U; Android 4.2.2; es-us; AVVIO_765 AVVIO 765 Build/JDQ39) AppleWebKit/534.30 (KHTML, like Gecko) Version/4.0 Mobile Safari/534.30"
    },
    "device": {
      "deviceName": "765",
      "marketingName": "765",
      "manufacturer": "Avvio",
      "brand": "Avvio",
      "pointingMethod": "touchscreen",
      "resolutionWidth": 320,
      "resolutionHeight": 480,
      "dualOrientation": true,
      "type": "smartphone"
    },
    "browser": {
      "name": "Android Webkit",
      "modus": null,
      "version": "4.0.0",
      "manufacturer": "Google",
      "bits": 32,
      "type": "browser"
    },
    "os": {
      "name": "Android",
      "marketingName": "Android",
      "version": "4.2.2",
      "manufacturer": "Google",
      "bits": 32
    },
    "engine": {
      "name": "WebKit",
      "version": "534.30.0",
      "manufacturer": "Apple"
    }
  },
  {
    "headers": {
      "user-agent": "Mozilla/5.0 (Linux; U; Android 4.2.2; es-us; Avvio_775 Build/JDQ39) AppleWebKit/534.30 (KHTML, like Gecko) Version/4.0 Mobile Safari/534.30"
    },
    "device": {
      "deviceName": "775",
      "marketingName": "775",
      "manufacturer": "Avvio",
      "brand": "Avvio",
      "pointingMethod": "touchscreen",
      "resolutionWidth": 480,
      "resolutionHeight": 800,
      "dualOrientation": true,
      "type": "smartphone"
    },
    "browser": {
      "name": "Android Webkit",
      "modus": null,
      "version": "4.0.0",
      "manufacturer": "Google",
      "bits": 32,
      "type": "browser"
    },
    "os": {
      "name": "Android",
      "marketingName": "Android",
      "version": "4.2.2",
      "manufacturer": "Google",
      "bits": 32
    },
    "engine": {
      "name": "WebKit",
      "version": "534.30.0",
      "manufacturer": "Apple"
    }
  }
]
