[
  {
    "headers": {
      "user-agent": "UCWEB/2.0 (MIDP-2.0; U; Adr 4.4; en-US; SPHS_on_Hsdroid) U2/1.0.0 UCBrowser/8.9.2.373 U2/1.0.0 Mobile"
    },
    "device": {
      "deviceName": "SPHS On HSDroid",
      "marketingName": "9500mini",
      "manufacturer": "MHorse",
      "brand": "MHorse",
      "pointingMethod": "touchscreen",
      "resolutionWidth": 320,
      "resolutionHeight": 480,
      "dualOrientation": true,
      "type": "smartphone"
    },
    "browser": {
      "name": "UC Browser",
      "modus": null,
      "version": "8.9.2.373",
      "manufacturer": "UcWeb",
      "bits": 32,
      "type": "transcoder"
    },
    "os": {
      "name": "Android",
      "marketingName": "Android",
      "version": "4.4.0",
      "manufacturer": "Google",
      "bits": 32
    },
    "engine": {
      "name": "U2",
      "version": "1.0.0",
      "manufacturer": "UcWeb"
    }
  }
]
