[
  {
    "headers": {
      "user-agent": "Mozilla/5.0 (Linux; U; Android 2.2.1; en-us; Nook Color (zoom2) Build/FROYO) AppleWebKit/533.1 (KHTML, like Gecko) Version/4.0 Mobile Safari/533.1"
    },
    "device": {
      "deviceName": "Zoom2",
      "marketingName": "Nook Color",
      "manufacturer": "Logicpd",
      "brand": "BarnesNoble",
      "pointingMethod": "touchscreen",
      "resolutionWidth": 1024,
      "resolutionHeight": 600,
      "dualOrientation": true,
      "type": "tablet"
    },
    "browser": {
      "name": "Android Webkit",
      "modus": null,
      "version": "4.0.0",
      "manufacturer": "Google",
      "bits": 32,
      "type": "browser"
    },
    "os": {
      "name": "Android",
      "marketingName": "Android",
      "version": "2.2.1",
      "manufacturer": "Google",
      "bits": 32
    },
    "engine": {
      "name": "WebKit",
      "version": "533.1.0",
      "manufacturer": "Apple"
    }
  }
]
