[
  {
    "headers": {
      "user-agent": "Mozilla/5.0 (Linux; Android 5.1; Picasso Build/LMY47I) AppleWebKit/537.36 (KHTML, like Gecko) Version/4.0 Chrome/39.0.0.0 Mobile Safari/537.36"
    },
    "device": {
      "deviceName": "Picasso",
      "marketingName": "Picasso",
      "manufacturer": "Bluboo",
      "brand": "Bluboo",
      "pointingMethod": "touchscreen",
      "resolutionWidth": 720,
      "resolutionHeight": 1280,
      "dualOrientation": true,
      "type": "smartphone"
    },
    "browser": {
      "name": "Android WebView",
      "modus": null,
      "version": "39.0.0.0",
      "manufacturer": "Google",
      "bits": 32,
      "type": "browser"
    },
    "os": {
      "name": "Android",
      "marketingName": "Android",
      "version": "5.1.0",
      "manufacturer": "Google",
      "bits": 32
    },
    "engine": {
      "name": "Blink",
      "version": "537.36.0",
      "manufacturer": "Google"
    }
  },
  {
    "headers": {
      "user-agent": "Mozilla/5.0 (Linux; Android 6.0; Bluboo Maya Max Build/MRA58K) AppleWebKit/537.36 (KHTML, like Gecko) Chrome/67.0.3396.68 Mobile Safari/537.36"
    },
    "device": {
      "deviceName": "Maya Max",
      "marketingName": "Maya Max",
      "manufacturer": "Bluboo",
      "brand": "Bluboo",
      "pointingMethod": "touchscreen",
      "resolutionWidth": 720,
      "resolutionHeight": 1280,
      "dualOrientation": true,
      "type": "smartphone"
    },
    "browser": {
      "name": "Chrome",
      "modus": null,
      "version": "67.0.3396.68",
      "manufacturer": "Google",
      "bits": 32,
      "type": "browser"
    },
    "os": {
      "name": "Android",
      "marketingName": "Android",
      "version": "6.0.0",
      "manufacturer": "Google",
      "bits": 32
    },
    "engine": {
      "name": "Blink",
      "version": "537.36.0",
      "manufacturer": "Google"
    }
  }
]
