[
  {
    "headers": {
      "user-agent": "Mozilla/5.0 (Linux; U; Android 4.2.2; ro-ro; E-Boda Rainbow V47 Build/JDQ39) AppleWebKit/534.30 (KHTML, like Gecko) Version/4.0 Mobile Safari/534.30"
    },
    "device": {
      "deviceName": "Rainbow V47",
      "marketingName": "Rainbow V47",
      "manufacturer": "E-Boda",
      "brand": "E-Boda",
      "pointingMethod": "touchscreen",
      "resolutionWidth": 480,
      "resolutionHeight": 800,
      "dualOrientation": true,
      "type": "smartphone"
    },
    "browser": {
      "name": "Android Webkit",
      "modus": null,
      "version": "4.0.0",
      "manufacturer": "Google",
      "bits": 32,
      "type": "browser"
    },
    "os": {
      "name": "Android",
      "marketingName": "Android",
      "version": "4.2.2",
      "manufacturer": "Google",
      "bits": 32
    },
    "engine": {
      "name": "WebKit",
      "version": "534.30.0",
      "manufacturer": "Apple"
    }
  }
]
