[
  {
    "headers": {
      "user-agent": "Mozilla/5.0 (Linux; Android 4.1.1; PULID F11 Build/JRO03C) AppleWebKit/537.36 (KHTML, like Gecko) Chrome/40.0.2214.89 Mobile Safari/537.36 OPR/27.0.1698.88647"
    },
    "device": {
      "deviceName": "F11",
      "marketingName": "F11",
      "manufacturer": "Pulid",
      "brand": "Pulid",
      "pointingMethod": "touchscreen",
      "resolutionWidth": 720,
      "resolutionHeight": 1280,
      "dualOrientation": true,
      "type": "smartphone"
    },
    "browser": {
      "name": "Opera Mobile",
      "modus": null,
      "version": "27.0.1698.88647",
      "manufacturer": "Opera",
      "bits": 32,
      "type": "browser"
    },
    "os": {
      "name": "Android",
      "marketingName": "Android",
      "version": "4.1.1",
      "manufacturer": "Google",
      "bits": 32
    },
    "engine": {
      "name": "Blink",
      "version": "537.36.0",
      "manufacturer": "Google"
    }
  },
  {
    "headers": {
      "user-agent": "Mozilla/5.0 (Linux; Android 4.1.1; PULID F15 Build/JRO03C) AppleWebKit/537.36 (KHTML, like Gecko) Chrome/40.0.2214.89 Mobile Safari/537.36 OPR/27.0.1698.88647"
    },
    "device": {
      "deviceName": "F15",
      "marketingName": "F15",
      "manufacturer": "Pulid",
      "brand": "Pulid",
      "pointingMethod": "touchscreen",
      "resolutionWidth": 720,
      "resolutionHeight": 1280,
      "dualOrientation": true,
      "type": "smartphone"
    },
    "browser": {
      "name": "Opera Mobile",
      "modus": null,
      "version": "27.0.1698.88647",
      "manufacturer": "Opera",
      "bits": 32,
      "type": "browser"
    },
    "os": {
      "name": "Android",
      "marketingName": "Android",
      "version": "4.1.1",
      "manufacturer": "Google",
      "bits": 32
    },
    "engine": {
      "name": "Blink",
      "version": "537.36.0",
      "manufacturer": "Google"
    }
  }
]
