[
  {
    "headers": {
      "user-agent": "Mozilla/5.0 (Linux; Android 4.4.2; Ilium L820 Build/KOT49H) AppleWebKit/537.36 (KHTML, like Gecko) Chrome/33.0.1750.136 Mobile Safari/537.36"
    },
    "device": {
      "deviceName": "Ilium L820",
      "marketingName": "Ilium L820",
      "manufacturer": "Lanix",
      "brand": "Lanix",
      "pointingMethod": "touchscreen",
      "resolutionWidth": 480,
      "resolutionHeight": 800,
      "dualOrientation": true,
      "type": "smartphone"
    },
    "browser": {
      "name": "Chrome",
      "modus": null,
      "version": "33.0.1750.136",
      "manufacturer": "Google",
      "bits": 32,
      "type": "browser"
    },
    "os": {
      "name": "Android",
      "marketingName": "Android",
      "version": "4.4.2",
      "manufacturer": "Google",
      "bits": 32
    },
    "engine": {
      "name": "Blink",
      "version": "537.36.0",
      "manufacturer": "Google"
    }
  }
]
